### ISSUE TITLE
Container starting does not work under swarm(1.2.6) standalone muti-manager mode .

### ISSUE THREAD

**Issue by nowol79** [docker/swarm#2640]
## Issue

Using a swarm consisting of 3-managers as shown in the following document. 
https://github.com/docker/docker.github.io/blob/master/swarm/multi-manager-setup.md

I was using the 1.2.4 swarm version in  standalone. (with consul). swarm 1.2.4 version worked well without any problems. 
but, Upgrading (manager&node) to 1.2.6. the following error occurs in the docker during container run. 

```
docker: Error response from daemon: 404 page not found.
```
Not every time I get an error, 3 or 4 request, may be successful once. 
docker log, it seems that the ```start json POST``` request is not received from swarm.

* success case docker log (success container start...)
```
time="2017-02-28T16:00:26.558735991+09:00" level=debug msg="Calling POST /v1.23/containers/create"
time="2017-02-28T16:00:26.559175237+09:00" level=debug msg="form data: {\"AttachStderr\": ..... NetworkingConfig\":{\\"}
"
time="2017-02-28T16:00:26.562938483+09:00" level=debug msg="devmapper: AddDevice(hash=2ed3cb5803eb86611287bf680a420e10ad00e3fdb16525d544050403616f57d7-init basehash=5d3728ed788bf26dbe56b1af7615e7073f83a87
35b28b05e6bb98693cd0541f5)"
time="2017-02-28T16:00:26.564199142+09:00" level=debug msg="devmapper: registerDevice(105, 2ed3cb5803eb86611287bf680a420e10ad00e3fdb16525d544050403616f57d7-init)"
time="2017-02-28T16:00:26.564773449+09:00" level=debug msg="devmapper: AddDevice(hash=2ed3cb5803eb86611287bf680a420e10ad00e3fdb16525d544050403616f57d7-init basehash=5d3728ed788bf26dbe56b1af7615e7073f83a87
35b28b05e6bb98693cd0541f5) END"
time="2017-02-28T16:00:26.564883358+09:00" level=debug msg="devmapper: activateDeviceIfNeeded(2ed3cb5803eb86611287bf680a420e10ad00e3fdb16525d544050403616f57d7-init)"
time="2017-02-28T16:00:26.586297738+09:00" level=debug msg="devmapper: UnmountDevice(hash=2ed3cb5803eb86611287bf680a420e10ad00e3fdb16525d544050403616f57d7-init)"
time="2017-02-28T16:00:26.586345477+09:00" level=debug msg="devmapper: Unmount(/docker/var/lib/devicemapper/mnt/2ed3cb5803eb86611287bf680a420e10ad00e3fdb16525d544050403616f57d7-init)"
time="2017-02-28T16:00:26.602525892+09:00" level=debug msg="devmapper: Unmount done"
time="2017-02-28T16:00:26.602566891+09:00" level=debug msg="devmapper: deactivateDevice(2ed3cb5803eb86611287bf680a420e10ad00e3fdb16525d544050403616f57d7-init)"
time="2017-02-28T16:00:26.602630371+09:00" level=debug msg="devmapper: removeDevice START(docker-8:3-41289011-2ed3cb5803eb86611287bf680a420e10ad00e3fdb16525d544050403616f57d7-init)"
time="2017-02-28T16:00:26.649353612+09:00" level=debug msg="devmapper: removeDevice END(docker-8:3-41289011-2ed3cb5803eb86611287bf680a420e10ad00e3fdb16525d544050403616f57d7-init)"
time="2017-02-28T16:00:26.649392170+09:00" level=debug msg="devmapper: deactivateDevice END(2ed3cb5803eb86611287bf680a420e10ad00e3fdb16525d544050403616f57d7-init)"
time="2017-02-28T16:00:26.649414305+09:00" level=debug msg="devmapper: UnmountDevice(hash=2ed3cb5803eb86611287bf680a420e10ad00e3fdb16525d544050403616f57d7-init) END"
time="2017-02-28T16:00:26.649435923+09:00" level=debug msg="devmapper: AddDevice(hash=2ed3cb5803eb86611287bf680a420e10ad00e3fdb16525d544050403616f57d7 basehash=2ed3cb5803eb86611287bf680a420e10ad00e3fdb165
25d544050403616f57d7-init)"
time="2017-02-28T16:00:26.650467798+09:00" level=debug msg="devmapper: registerDevice(106, 2ed3cb5803eb86611287bf680a420e10ad00e3fdb16525d544050403616f57d7)"
time="2017-02-28T16:00:26.650897884+09:00" level=debug msg="devmapper: AddDevice(hash=2ed3cb5803eb86611287bf680a420e10ad00e3fdb16525d544050403616f57d7 basehash=2ed3cb5803eb86611287bf680a420e10ad00e3fdb16525d544050403616f57d7-init) END"
time="2017-02-28T16:00:26.651570151+09:00" level=debug msg="devmapper: activateDeviceIfNeeded(2ed3cb5803eb86611287bf680a420e10ad00e3fdb16525d544050403616f57d7)"
time="2017-02-28T16:00:26.679896830+09:00" level=debug msg="container mounted via layerStore: /var/lib/devicemapper/mnt/2ed3cb5803eb86611287bf680a420e10ad00e3fdb16525d544050403616f57d7/rootfs"
time="2017-02-28T16:00:26.679950621+09:00" level=debug msg="devmapper: UnmountDevice(hash=2ed3cb5803eb86611287bf680a420e10ad00e3fdb16525d544050403616f57d7)"
time="2017-02-28T16:00:26.679975873+09:00" level=debug msg="devmapper: Unmount(/var/lib/devicemapper/mnt/2ed3cb5803eb86611287bf680a420e10ad00e3fdb16525d544050403616f57d7)"
time="2017-02-28T16:00:26.691472640+09:00" level=debug msg="devmapper: Unmount done"
time="2017-02-28T16:00:26.691512025+09:00" level=debug msg="devmapper: deactivateDevice(2ed3cb5803eb86611287bf680a420e10ad00e3fdb16525d544050403616f57d7)"
time="2017-02-28T16:00:26.691600857+09:00" level=debug msg="devmapper: removeDevice START(docker-8:3-41289011-2ed3cb5803eb86611287bf680a420e10ad00e3fdb16525d544050403616f57d7)"
time="2017-02-28T16:00:26.730353965+09:00" level=debug msg="devmapper: removeDevice END(docker-8:3-41289011-2ed3cb5803eb86611287bf680a420e10ad00e3fdb16525d544050403616f57d7)"
time="2017-02-28T16:00:26.730396600+09:00" level=debug msg="devmapper: deactivateDevice END(2ed3cb5803eb86611287bf680a420e10ad00e3fdb16525d544050403616f57d7)"
time="2017-02-28T16:00:26.730420513+09:00" level=debug msg="devmapper: UnmountDevice(hash=2ed3cb5803eb86611287bf680a420e10ad00e3fdb16525d544050403616f57d7) END"
time="2017-02-28T16:00:26.731393973+09:00" level=debug msg="Calling GET /v1.23/containers/json?all=1&filters=%7B%22id%22%3A%7B%22b0b836da6794747779f1093769a35d694b5df582c468ad670797dd5064616a32%22%3Atrue%7D%7D&limit=0"
time="2017-02-28T16:00:26.731438016+09:00" level=debug msg="Calling GET /v1.23/containers/json?all=1&filters=%7B%22id%22%3A%7B%22b0b836da6794747779f1093769a35d694b5df582c468ad670797dd5064616a32%22%3Atrue%7D%7D&limit=0"
time="2017-02-28T16:00:26.731549095+09:00" level=debug msg="Calling GET /v1.23/containers/json?all=1&filters=%7B%22id%22%3A%7B%22b0b836da6794747779f1093769a35d694b5df582c468ad670797dd5064616a32%22%3Atrue%7D%7D&limit=0"
time="2017-02-28T16:00:26.731401141+09:00" level=debug msg="Calling GET /v1.23/containers/json?all=1&filters=%7B%22id%22%3A%7B%22b0b836da6794747779f1093769a35d694b5df582c468ad670797dd5064616a32%22%3Atrue%7D%7D&limit=0"
time="2017-02-28T16:00:26.732452992+09:00" level=debug msg="Calling GET /v1.23/containers/b0b836da6794747779f1093769a35d694b5df582c468ad670797dd5064616a32/json"
time="2017-02-28T16:00:26.732622002+09:00" level=debug msg="Calling GET /v1.23/containers/b0b836da6794747779f1093769a35d694b5df582c468ad670797dd5064616a32/json"
time="2017-02-28T16:00:26.732810260+09:00" level=debug msg="Calling GET /v1.23/containers/b0b836da6794747779f1093769a35d694b5df582c468ad670797dd5064616a32/json"
time="2017-02-28T16:00:26.733059364+09:00" level=debug msg="Calling GET /v1.23/containers/b0b836da6794747779f1093769a35d694b5df582c468ad670797dd5064616a32/json"
time="2017-02-28T16:00:26.735615861+09:00" level=debug msg="Calling POST /v1.23/containers/b0b836da6794747779f1093769a35d694b5df582c468ad670797dd5064616a32/start"
time="2017-02-28T16:00:26.736164808+09:00" level=debug msg="devmapper: activateDeviceIfNeeded(2ed3cb5803eb86611287bf680a420e10ad00e3fdb16525d544050403616f57d7)"
time="2017-02-28T16:00:26.758326434+09:00" level=debug msg="container mounted via layerStore: /docker/var/lib/devicemapper/mnt/2ed3cb5803eb86611287bf680a420e10ad00e3fdb16525d544050403616f57d7/rootfs"
time="2017-02-28T16:00:26.762560388+09:00" level=debug msg="Assigning addresses for endpoint fervent_einstein's interface on network bridge"
time="2017-02-28T16:00:26.762609331+09:00" level=debug msg="RequestAddress(LocalDefault/172.17.0.0/16, <nil>, map[])"
time="2017-02-28T16:00:26.763963382+09:00" level=debug msg="Assigning addresses for endpoint fervent_einstein's interface on network bridge"
time="2017-02-28T16:00:26.770644561+09:00" level=debug msg="Programming external connectivity on endpoint fervent_einstein (5e51df51b360fc66c1a8c9a2a2c1a2dd363c90f4c7bd13e11d06cf11224f0c00)"
time="2017-02-28T16:00:26.770827081+09:00" level=debug msg="/sbin/iptables, [--wait -t nat -A DOCKER -p tcp -d 0/0 --dport 32772 -j DNAT --to-destination 172.17.0.2:20757 ! -i docker0]"
time="2017-02-28T16:00:26.774864027+09:00" level=debug msg="/sbin/iptables, [--wait -t filter -A DOCKER ! -i docker0 -o docker0 -p tcp -d 172.17.0.2 --dport 20757 -j ACCEPT]"
time="2017-02-28T16:00:26.778120194+09:00" level=debug msg="/sbin/iptables, [--wait -t nat -A POSTROUTING -p tcp -s 172.17.0.2 -d 172.17.0.2 --dport 20757 -j MASQUERADE]"
time="2017-02-28T16:00:26.805895896+09:00" level=debug msg="Calling GET /v1.23/networks/d29c1adef5e98031a05ae8a8adf6a4e899f69928d7b3be08a33cb5678f484cbf"
time="2017-02-28T16:00:26.805895608+09:00" level=debug msg="Calling GET /v1.23/networks/d29c1adef5e98031a05ae8a8adf6a4e899f69928d7b3be08a33cb5678f484cbf"
time="2017-02-28T16:00:26.806106955+09:00" level=debug msg="Calling GET /v1.23/networks/d29c1adef5e98031a05ae8a8adf6a4e899f69928d7b3be08a33cb5678f484cbf"
time="2017-02-28T16:00:26.899231279+09:00" level=debug msg="sandbox set key processing took 42.336597ms for container b0b836da6794747779f1093769a35d694b5df582c468ad670797dd5064616a32"
time="2017-02-28T16:00:26.931214749+09:00" level=debug msg="received containerd event: &types.Event{Type:\"start-container\", Id:\"b0b836da6794747779f1093769a35d694b5df582c468ad670797dd5064616a32\", Status:0x0, Pid:\"\", Timestamp:0x58b5200a}"
time="2017-02-28T16:00:26.932433495+09:00" level=debug msg="event unhandled: type:\"start-container\" id:\"b0b836da6794747779f1093769a35d694b5df582c468ad670797dd5064616a32\" timestamp:1488265226 "
time="2017-02-28T16:00:26.932720040+09:00" level=debug msg="Calling GET /v1.23/containers/json?all=1&filters=%7B%22id%22%3A%7B%22b0b836da6794747779f1093769a35d694b5df582c468ad670797dd5064616a32%22%3Atrue%7D%7D&limit=0"
time="2017-02-28T16:00:26.932752232+09:00" level=debug msg="Calling GET /v1.23/containers/json?all=1&filters=%7B%22id%22%3A%7B%22b0b836da6794747779f1093769a35d694b5df582c468ad670797dd5064616a32%22%3Atrue%7D%7D&limit=0"
time="2017-02-28T16:00:26.932777419+09:00" level=debug msg="Calling GET /v1.23/containers/json?all=1&filters=%7B%22id%22%3A%7B%22b0b836da6794747779f1093769a35d694b5df582c468ad670797dd5064616a32%22%3Atrue%7D%7D&limit=0"
time="2017-02-28T16:00:26.932892548+09:00" level=debug msg="Calling GET /v1.23/containers/json?all=1&filters=%7B%22id%22%3A%7B%22b0b836da6794747779f1093769a35d694b5df582c468ad670797dd5064616a32%22%3Atrue%7D%7D&limit=0"
time="2017-02-28T16:00:26.932898250+09:00" level=debug msg="Calling GET /containers/b0b836da6794747779f1093769a35d694b5df582c468ad670797dd5064616a32/json"
time="2017-02-28T16:00:26.933927126+09:00" level=debug msg="Calling GET /v1.23/containers/b0b836da6794747779f1093769a35d694b5df582c468ad670797dd5064616a32/json"
time="2017-02-28T16:00:26.934249953+09:00" level=debug msg="Calling GET /v1.23/containers/b0b836da6794747779f1093769a35d694b5df582c468ad670797dd5064616a32/json"
time="2017-02-28T16:00:26.934358800+09:00" level=debug msg="Calling GET /v1.23/containers/b0b836da6794747779f1093769a35d694b5df582c468ad670797dd5064616a32/json"
time="2017-02-28T16:00:26.934625496+09:00" level=debug msg="Calling GET /v1.23/containers/b0b836da6794747779f1093769a35d694b5df582c468ad670797dd5064616a32/json"
```

* error case docker log
```
time="2017-02-28T16:00:19.111800054+09:00" level=debug msg="Calling POST /v1.23/containers/create"
time="2017-02-28T16:00:19.112226790+09:00" level=debug msg="form data: {\"AttachStderr\":false .......},\"NetworkingConfig\":{}"
time="2017-02-28T16:00:19.116057288+09:00" level=debug msg="devmapper: AddDevice(hash=00de6574783541d9f7708a7aef30235877a2d152b6947bb61b7ed540059f323c-init basehash=5d3728ed788bf26dbe56b1af7615e7073f83a8735b28b05e6bb98693cd0541f5)"
time="2017-02-28T16:00:19.117308097+09:00" level=debug msg="devmapper: registerDevice(103, 00de6574783541d9f7708a7aef30235877a2d152b6947bb61b7ed540059f323c-init)"
time="2017-02-28T16:00:19.117909767+09:00" level=debug msg="devmapper: AddDevice(hash=00de6574783541d9f7708a7aef30235877a2d152b6947bb61b7ed540059f323c-init basehash=5d3728ed788bf26dbe56b1af7615e7073f83a8735b28b05e6bb98693cd0541f5) END"
time="2017-02-28T16:00:19.118022102+09:00" level=debug msg="devmapper: activateDeviceIfNeeded(00de6574783541d9f7708a7aef30235877a2d152b6947bb61b7ed540059f323c-init)"
time="2017-02-28T16:00:19.143452343+09:00" level=debug msg="devmapper: UnmountDevice(hash=00de6574783541d9f7708a7aef30235877a2d152b6947bb61b7ed540059f323c-init)"
time="2017-02-28T16:00:19.143499124+09:00" level=debug msg="devmapper: Unmount(/var/lib/devicemapper/mnt/00de6574783541d9f7708a7aef30235877a2d152b6947bb61b7ed540059f323c-init)"
time="2017-02-28T16:00:19.161393211+09:00" level=debug msg="devmapper: Unmount done"
time="2017-02-28T16:00:19.161429754+09:00" level=debug msg="devmapper: deactivateDevice(00de6574783541d9f7708a7aef30235877a2d152b6947bb61b7ed540059f323c-init)"
time="2017-02-28T16:00:19.161517000+09:00" level=debug msg="devmapper: removeDevice START(docker-8:3-41289011-00de6574783541d9f7708a7aef30235877a2d152b6947bb61b7ed540059f323c-init)"
time="2017-02-28T16:00:19.202376241+09:00" level=debug msg="devmapper: removeDevice END(docker-8:3-41289011-00de6574783541d9f7708a7aef30235877a2d152b6947bb61b7ed540059f323c-init)"
time="2017-02-28T16:00:19.202418838+09:00" level=debug msg="devmapper: deactivateDevice END(00de6574783541d9f7708a7aef30235877a2d152b6947bb61b7ed540059f323c-init)"
time="2017-02-28T16:00:19.202442171+09:00" level=debug msg="devmapper: UnmountDevice(hash=00de6574783541d9f7708a7aef30235877a2d152b6947bb61b7ed540059f323c-init) END"
time="2017-02-28T16:00:19.202464349+09:00" level=debug msg="devmapper: AddDevice(hash=00de6574783541d9f7708a7aef30235877a2d152b6947bb61b7ed540059f323c basehash=00de6574783541d9f7708a7aef30235877a2d152b6947bb61b7ed540059f323c-init)"
time="2017-02-28T16:00:19.203524898+09:00" level=debug msg="devmapper: registerDevice(104, 00de6574783541d9f7708a7aef30235877a2d152b6947bb61b7ed540059f323c)"
time="2017-02-28T16:00:19.203973356+09:00" level=debug msg="devmapper: AddDevice(hash=00de6574783541d9f7708a7aef30235877a2d152b6947bb61b7ed540059f323c basehash=00de6574783541d9f7708a7aef30235877a2d152b6947bb61b7ed540059f323c-init) END"
time="2017-02-28T16:00:19.204705537+09:00" level=debug msg="devmapper: activateDeviceIfNeeded(00de6574783541d9f7708a7aef30235877a2d152b6947bb61b7ed540059f323c)"
time="2017-02-28T16:00:19.228055814+09:00" level=debug msg="container mounted via layerStore: /var/lib/devicemapper/mnt/00de6574783541d9f7708a7aef30235877a2d152b6947bb61b7ed540059f323c/rootfs"
time="2017-02-28T16:00:19.228104049+09:00" level=debug msg="devmapper: UnmountDevice(hash=00de6574783541d9f7708a7aef30235877a2d152b6947bb61b7ed540059f323c)"
time="2017-02-28T16:00:19.228127300+09:00" level=debug msg="devmapper: Unmount(/var/lib/devicemapper/mnt/00de6574783541d9f7708a7aef30235877a2d152b6947bb61b7ed540059f323c)"
time="2017-02-28T16:00:19.245473654+09:00" level=debug msg="devmapper: Unmount done"
time="2017-02-28T16:00:19.245517231+09:00" level=debug msg="devmapper: deactivateDevice(00de6574783541d9f7708a7aef30235877a2d152b6947bb61b7ed540059f323c)"
time="2017-02-28T16:00:19.245592557+09:00" level=debug msg="devmapper: removeDevice START(docker-8:3-41289011-00de6574783541d9f7708a7aef30235877a2d152b6947bb61b7ed540059f323c)"
time="2017-02-28T16:00:19.282349247+09:00" level=debug msg="devmapper: removeDevice END(docker-8:3-41289011-00de6574783541d9f7708a7aef30235877a2d152b6947bb61b7ed540059f323c)"
time="2017-02-28T16:00:19.282381824+09:00" level=debug msg="devmapper: deactivateDevice END(00de6574783541d9f7708a7aef30235877a2d152b6947bb61b7ed540059f323c)"
time="2017-02-28T16:00:19.282404362+09:00" level=debug msg="devmapper: UnmountDevice(hash=00de6574783541d9f7708a7aef30235877a2d152b6947bb61b7ed540059f323c) END"
time="2017-02-28T16:00:19.283367888+09:00" level=debug msg="Calling GET /v1.23/containers/json?all=1&filters=%7B%22id%22%3A%7B%227adcee6b2c5455e64dbedc1956ed4cbd9b588c4492b923a18f5aaf90586465d0%22%3Atrue%7D%7D&limit=0"
time="2017-02-28T16:00:19.283450258+09:00" level=debug msg="Calling GET /v1.23/containers/json?all=1&filters=%7B%22id%22%3A%7B%227adcee6b2c5455e64dbedc1956ed4cbd9b588c4492b923a18f5aaf90586465d0%22%3Atrue%7D%7D&limit=0"
time="2017-02-28T16:00:19.283509310+09:00" level=debug msg="Calling GET /v1.23/containers/json?all=1&filters=%7B%22id%22%3A%7B%227adcee6b2c5455e64dbedc1956ed4cbd9b588c4492b923a18f5aaf90586465d0%22%3Atrue%7D%7D&limit=0"
time="2017-02-28T16:00:19.283672681+09:00" level=debug msg="Calling GET /v1.23/containers/json?all=1&filters=%7B%22id%22%3A%7B%227adcee6b2c5455e64dbedc1956ed4cbd9b588c4492b923a18f5aaf90586465d0%22%3Atrue%7D%7D&limit=0"
time="2017-02-28T16:00:19.284566100+09:00" level=debug msg="Calling GET /v1.23/containers/7adcee6b2c5455e64dbedc1956ed4cbd9b588c4492b923a18f5aaf90586465d0/json"
time="2017-02-28T16:00:19.284795852+09:00" level=debug msg="Calling GET /v1.23/containers/7adcee6b2c5455e64dbedc1956ed4cbd9b588c4492b923a18f5aaf90586465d0/json"
time="2017-02-28T16:00:19.284931053+09:00" level=debug msg="Calling GET /v1.23/containers/7adcee6b2c5455e64dbedc1956ed4cbd9b588c4492b923a18f5aaf90586465d0/json"
time="2017-02-28T16:00:19.285051943+09:00" level=debug msg="Calling GET /v1.23/containers/7adcee6b2c5455e64dbedc1956ed4cbd9b588c4492b923a18f5aaf90586465d0/json"
```

docker did not receive a start json POST request at all in the error situation. 
```
Calling POST /v1.23/containers/b0b836da6794747779f1093769a35d694b5df582c468ad670797dd5064616a32/start
```

I guess that's because the "create POST request" and "start POST request" sync do not fit between the managers??? 

- What can I do fix it?
- Is there a way to see the data sync log between the swarm managers??

## Versions

* manager(3)/ node(4)  - Docker (manager, node same docker version)
```
Client:
 Version:      1.11.2
 API version:  1.23
 Go version:   go1.5.4
 Git commit:   16c22bb
 Built:        Thu Jun  2 10:23:59 2016
 OS/Arch:      linux/amd64

Server:
 Version:      1.11.2
 API version:  1.23
 Go version:   go1.5.4
 Git commit:   16c22bb
 Built:        Thu Jun  2 10:23:59 2016
 OS/Arch:      linux/amd64
```
* manager(3)/ node(4) - swarm (manager, node same swarm version)
  * [1.2.6](https://github.com/docker/swarm/releases/tag/v1.2.6)

* manager swarm starting command
```
$ swarm --debug manage --host=unix:///var/run/swarm.sock --host=tcp://0.0.0.0:$PORT --tls --tlscacert=$CERT_PATH/key/ca.pem --tlscert=$CERT_PATH/key/cert.pem --tlskey=$CERT_PATH/key/key.pem --replication --replication-ttl 20s --heartbeat 2s --cluster-opt swarm.overcommit=0 --advertise $LOCALHOST_NAME:$PORT consul://consul.com:8500/node

```
 * node swarm starting commnd
```
$ swarm join --advertise=$LOCALHOST_NAME:2376 --heartbeat 60s --ttl 180s consul://127.0.0.1:8500/node
```
each node(localhost) has a consul agent. 
```
consul agent -data-dir=/consul/data -config-dir=/consul/config -datacenter AAA -node=$HOST_NAME -advertise $MANAGER_NODE_VIP -join $MANAGER_NODE-1 -join $MANAGER_NODE-2 -join $MANAGER_NODE-3
```

## Notes.

There is no problem using only one swarm manager.  :) 
It seems obvious that the data sync for requests between multiple managers are not correct, but I do not know how to fix them. help me plz.. 🙇

**Comment by dongluochen** [comment]
@nowol79 Thanks for reporting the problem. Can you show the full commands or API calls to manager? Does this happen with any image or only specific image? 

Can you show the logs from docker manager? For example, here is the logs when I issue `docker -H manager:port run -d --name nginx nginx:1.10`.  You can get debug log with `swarm --debug -l debug manage ...`.

```
DEBU[0046] HTTP request received                         method=POST uri=/v1.24/containers/create?name=ngix
DEBU[0063] Watch triggered with 1 nodes                  discovery=consul
DEBU[0065] Scheduling container ngix to                  NodeID=3JWA:KW24:25WK:ASMB:6IMO:OXSP:WTR3:2BZG:X3IJ:H3V7:PC4H:VL73 NodeName=ip-172-19-71-145
DEBU[0065] HTTP request received                         method=POST uri=/v1.24/containers/d456dd2d09e9b1311acf3f02a1bc2125f9d6ee333f938a535875d74a1ec1a71d/start
DEBU[0081] Engine update succeeded                       id=3JWA:KW24:25WK:ASMB:6IMO:OXSP:WTR3:2BZG:X3IJ:H3V7:PC4H:VL73 name=ip-172-19-71-145
```

**Comment by nowol79** [comment]
If it is swarm 1.2.4, the swarm log is as follows.  (In all cases success.)

For ex, swarm master host A, B, C(3) 
A, B, C same VIP (1.1.1.1) port 3333 
A is primary (=leader)

All manager hosts start with...
```
swarm --debug -l debug manage --host=unix:///var/run/swarm.sock --host=tcp://0.0.0.0:3333 --replication --replication-ttl 20s --heartbeat 2s --cluster-opt swarm.overcommit=0 --advertise A:3333 consul://consul.test.com:8500/nodes
```

## swarm 1.2.4 case
- case 1.  (ok) 
```
$  docker -H 1.1.1.1:3333 run -d nginx:1.10   => request VIP
```
- swarm log 
```
time="2017-03-02T17:29:24+09:00" level=debug msg="HTTP request received" method=POST uri="/v1.23/containers/create"
time="2017-03-02T17:29:24+09:00" level=debug msg="Scheduling container  to " NodeID="L57L:BQEM:SX3E:UV3K:F6H2:Y72W:CGYN:S2JA:NRXY:EHNA:MO36:XXOP" NodeName=10.X.X.X
time="2017-03-02T17:29:24+09:00" level=debug msg="HTTP request received" method=POST uri="/v1.23/containers/b545c46898b4cd1f91b96c887561ed39207978c68206ae1be6536aa6fa9ee12d/start"
```
- case 2 (ok)
```
$ docker -H A:3333 run -d nginx:1.10    => request leader host
```
leader swarm log
```
time="2017-03-02T17:34:05+09:00" level=debug msg="HTTP request received" method=POST uri="/v1.23/containers/create"
time="2017-03-02T17:34:05+09:00" level=debug msg="Scheduling container  to " NodeID="L57L:BQEM:SX3E:UV3K:F6H2:Y72W:CGYN:S2JA:NRXY:EHNA:MO36:XXOP" NodeName=10.X.X.X
time="2017-03-02T17:34:05+09:00" level=debug msg="HTTP request received" method=POST uri="/v1.23/containers/81ecfe428358b663e8c9c590ae0dad3e86ca666400f7ae388be5ef70c6a03d73/start"
```

* case 3 (ok)

```
$ docker -H B:3333 run -d nginx:1.10    => request non-leader host
$ docker -H C:3333 run -d nginx:1.10    => request non-leader host
```
swarm log (B)
```
time="2017-03-02T17:36:30+09:00" level=debug msg="Proxy hijack request" addr="A:3333"
```
swarm log (C)
```
time="2017-03-02T17:36:30+09:00" level=debug msg="Proxy hijack request" addr="A:3333"
```

Even if the host specification is B or C, there is no way to directly check JSON request API log..
"Proxy hijack request" .. 😢 

Anyway, swarm 1.2.4 is all successful..

## swarm 1.2.6 case

- case 1 (ok or fail..)

```
$ docker -H VIP:3333 run -d nginx:1.10
```
leader swarm log
```
time="2017-03-02T17:55:22+09:00" level=debug msg="HTTP request received" method=POST uri="/v1.23/containers/create"
time="2017-03-02T17:55:23+09:00" level=debug msg="Scheduling container 55d3ec19739f to " NodeID="L57L:BQEM:SX3E:UV3K:F6H2:Y72W:CGYN:S2JA:NRXY:EHNA:MO36:XXOP" NodeName=10.X.X.X
```
start JSON request not received..

- case 2  ```Request to leader manager!! A``` (all request ok 100%)

```
$ docker -H A:3333 run -d nginx:1.10    => request leader host
```

leader swarm log

```
time="2017-03-02T17:58:55+09:00" level=debug msg="HTTP request received" method=POST uri="/v1.23/containers/create"
time="2017-03-02T17:58:55+09:00" level=debug msg="Scheduling container ff68062d8aca to " NodeID="L57L:BQEM:SX3E:UV3K:F6H2:Y72W:CGYN:S2JA:NRXY:EHNA:MO36:XXOP" NodeName=10.X.X.X
time="2017-03-02T17:58:55+09:00" level=debug msg="HTTP request received" method=POST uri="/v1.23/containers/ff68062d8aca3052ba685494de889c4e32cc3d275ac18d7757642d5b42d60c44/start"
```

- case 3 (all request fail .. 100% )

```
$ docker -H B:3333 run -d nginx:1.10    => request non-leader host
$ docker -H C:3333 run -d nginx:1.10    => request non-leader host
fb5e37fb8282e4325ddd9c7b8b5597137ae67a69d6a91925a8cbc467a0cd8563
/naver/docker/bin/docker: Error response from daemon: 404 page not found.
```
swarm log (B)
```
time="2017-03-02T17:36:30+09:00" level=debug msg="Proxy hijack request" addr="A:3333"
```
swarm log (C)
```
time="2017-03-02T17:36:30+09:00" level=debug msg="Proxy hijack request" addr="A:3333"
```

leader swarm agent (A host) log
```
time="2017-03-02T18:09:11+09:00" level=debug msg="HTTP request received" method=POST uri="/v1.23/containers/create"
time="2017-03-02T18:09:11+09:00" level=debug msg="Scheduling container fb5e37fb8282 to " NodeID="L57L:BQEM:SX3E:UV3K:F6H2:Y72W:CGYN:S2JA:NRXY:EHNA:MO36:XXOP" NodeName=css0763
```
the ```start JSON request``` is not in the log.

But!! 
At failed time, A host(leader) tcpdump has start JSON packet!! 
```
18:09:11.253932 IP (tos 0x0, ttl 64, id 9274, offset 0, flags [DF], proto TCP (6), length 287)
    B-HOST.58996 > A-HOST.cdbroker: Flags [P.], cksum 0x2760 (correct), seq 1552:1787, ack 187, win 237, options [nop,nop,TS val 3891338338 ecr 3892804327], length 235
        0x0000:  4500 011f 243a 4000 4006 f791 0a72 8495  E...$:@.@....r..
        0x0010:  0a72 8494 e674 0d30 9202 45a3 83f2 355b  .r...t.0..E...5[
        0x0020:  8018 00ed 2760 0000 0101 080a e7f1 1c62  ....'`.........b
        0x0030:  e807 7ae7 4f53 5420 2f76 312e 3233 2f63  ..z.OST./v1.23/c
        0x0040:  6f6e 7461 696e 6572 732f 6662 3565 3337  ontainers/fb5e37
        0x0050:  6662 3832 3832 6534 3332 3564 6464 3963  fb8282e4325ddd9c
        0x0060:  3762 3862 3535 3937 3133 3761 6536 3761  7b8b5597137ae67a
        0x0070:  3639 6436 6139 3139 3235 6138 6362 6334  69d6a91925a8cbc4
        0x0080:  3637 6130 6364 3835 3633 2f73 7461 7274  67a0cd8563/start
        0x0090:  2048 5454 502f 312e 310d 0a48 6f73 743a  .HTTP/1.1..Host:
        0x00a0:  2063 7373 3037 3631 3a33 3337 360d 0a55  .css0761:3376..U
        0x00b0:  7365 722d 4167 656e 743a 2044 6f63 6b65  ser-Agent:.Docke
        0x00c0:  722d 436c 6965 6e74 2f31 2e31 312e 3220  r-Client/1.11.2.
        0x00d0:  286c 696e 7578 290d 0a43 6f6e 7465 6e74  (linux)..Content
        0x00e0:  2d4c 656e 6774 683a 2030 0d0a 436f 6e74  -Length:.0..Cont
        0x00f0:  656e 742d 5479 7065 3a20 7465 7874 2f70  ent-Type:.text/p
        0x0100:  6c61 696e 0d0a 4163 6365 7074 2d45 6e63  lain..Accept-Enc
        0x0110:  6f64 696e 673a 2067 7a69 700d 0a0d 0a    oding:.gzip....

18:09:11.253944 IP (tos 0x0, ttl 64, id 20110, offset 0, flags [DF], proto TCP (6), length 52)
    A-HOST.cdbroker > B-HOST.58996: Flags [.], cksum 0x1e34 (incorrect -> 0x6ad6), seq 187, ack 1787, win 274, options [nop,nop,TS val 3892804328 ecr 3891338338], length 0
        0x0000:  4500 0034 4e8e 4000 4006 ce28 0a72 8494  E..4N.@.@..(.r..
        0x0010:  0a72 8495 0d30 e674 83f2 355b 9202 468e  .r...0.t..5[..F.
        0x0020:  8010 0112 1e34 0000 0101 080a e807 7ae8  .....4........z.
        0x0030:  e7f1 1c62                                ...b
18:09:11.254369 IP (tos 0x0, ttl 64, id 20111, offset 0, flags [DF], proto TCP (6), length 228)
    A-HOST.cdbroker > B-HOST.58996: Flags [P.], cksum 0x1ee4 (incorrect -> 0x36ab), seq 187:363, ack 1787, win 274, options [nop,nop,TS val 3892804329 ecr 3891338338], length 176
        0x0000:  4500 00e4 4e8f 4000 4006 cd77 0a72 8494  E...N.@.@..w.r..
        0x0010:  0a72 8495 0d30 e674 83f2 355b 9202 468e  .r...0.t..5[..F.
        0x0020:  8018 0112 1ee4 0000 0101 080a e807 7ae9  ..............z.
        0x0030:  e7f1 1c62 4854 5450 2f31 2e31 2034 3034  ...bHTTP/1.1.404
        0x0040:  204e 6f74 2046 6f75 6e64 0d0a 436f 6e74  .Not.Found..Cont
        0x0050:  656e 742d 5479 7065 3a20 7465 7874 2f70  ent-Type:.text/p
        0x0060:  6c61 696e 3b20 6368 6172 7365 743d 7574  lain;.charset=ut
        0x0070:  662d 380d 0a58 2d43 6f6e 7465 6e74 2d54  f-8..X-Content-T
        0x0080:  7970 652d 4f70 7469 6f6e 733a 206e 6f73  ype-Options:.nos
        0x0090:  6e69 6666 0d0a 4461 7465 3a20 5468 752c  niff..Date:.Thu,
        0x00a0:  2030 3220 4d61 7220 3230 3137 2030 393a  .02.Mar.2017.09:
        0x00b0:  3039 3a31 3120 474d 540d 0a43 6f6e 7465  09:11.GMT..Conte
        0x00c0:  6e74 2d4c 656e 6774 683a 2031 390d 0a0d  nt-Length:.19...
        0x00d0:  0a34 3034 2070 6167 6520 6e6f 7420 666f  .404.page.not.fo
        0x00e0:  756e 640a                                und.

```

node D-HOST(node) ```fb5e37fb8282``` 's STATUS is Created, not Running 

```
[irteam@css0763 ~]$ docker ps -a
CONTAINER ID        IMAGE                                                       COMMAND                  CREATED             STATUS                   PORTS               NAMES
fb5e37fb8282        nginx:1.10                                                  "nginx -g 'daemon off"   9 minutes ago       Created                                      reverent_knuth
```

**Comment by dongluochen** [comment]
Thanks a lot for the detail information and the tcpdump result. 

For some reason the request from B-HOST is forwarded to A-HOST's port 3376 (cdbroker). In your configuration the request should be forwarded to A-HOST's port 3333. I don't know where this port 3376 comes from. 

```
18:09:11.253932 IP (tos 0x0, ttl 64, id 9274, offset 0, flags [DF], proto TCP (6), length 287)
    B-HOST.58996 > A-HOST.cdbroker: Flags [P.], cksum 0x2760 (correct), seq 1552:1787, ack 187, win 237, options [nop,nop,TS val 3891338338 ecr 3892804327], length 235
        0x0000:  4500 011f 243a 4000 4006 f791 0a72 8495  E...$:@.@....r..
```

If you use tcpdump to capture the full request sequence, do you see the `create` and `start` requests sent on different TCP connection?

**Comment by nowol79** [comment]
For security reasons, I used host and port in fake... ^^;;
Ignore it. (3376)

**Comment by dongluochen** [comment]
Can you try `docker run -H manager:port create `? The follow with `docker run -H manager:port start` and look at manager's log? In your case the manager doesn't recognize the `start` request, but even that the manager should have logs like the following. But they are not shown in your logs. 

```
DEBU[1625] HTTP request received                         method=POST uri=/v1.23/containers/3939x3993/start
ERRO[1625] HTTP error: No such container 3939x3993       status=404
```

**Comment by nowol79** [comment]
Removing the ```--replication``` option from swarm manager works fine.

**Comment by dongluochen** [comment]
do you mean without `--replication` the replica can continue to forward requests to master, and your problem is resolved?

**Comment by nowol79** [comment]
Yes,.. but without the replication option, I will not be able to mirror the three managers, so I can not guarantee a high-availability cluster.  😢 

more tracking why the ```start JSON POST request``` does not stay in the log.

By the way... from above, ```docker run -H manager:port create``` , ```docker run -H manager:port start```  is there(docker 1.11.2) a create, start command??

**Comment by dongluochen** [comment]
Of course `--replication` should be supported. However I cannot reproduce your problem with Swarm 1.2.6 and Docker 1.11.2. 

Each `docker run` is implemented by `docker create` followed by a `docker start`. You should be able to execute them manually. What do you see from that?

**Comment by nowol79** [comment]
I'm sorry for the inconvenience... 
Can you give me a detailed description of the configuration you have reproduced?
I am going to test the new configuration again. Plz.. 🙇 

and then... do you mean to use manually create&start through docker engine API? :)

**Comment by dongluochen** [comment]
I have 2 nodes running Docker 1.11.2 and I manually start [swarm-1.2.6](https://github.com/docker/swarm/releases/download/v1.2.6/swarm-1.2.6-linux-x86_64.tgz) on each of them. 
```
./swarm-1.2.6 --debug -l debug manage --replication --advertise host_IP:3377 -H :3377 --discovery-opt kv.path=docker/nodes consul://consul_ip:8500/swarm/
```

`docker -H manager:port run --name t1 nginx` is actually accomplished in 2 steps. Step 1 is `docker -H manager:port create --name t1 nginx`. Step 2 is `docker -H manager:port start t1`. You can try them to see if manually running 2 steps succeeds or not. If the manual steps succeed, you can use tcpdump to compare it with the result from `docker -H manager:port run ...`.

**Comment by nowol79** [comment]
I followed your composition. Same swam-1.2.6 download.

Your configuration is a situation where you have 2 nodes and a leader with one manage.
It looks like the second case of swarm-1.2.6 above. ``` case 2 Request to leader manager!! A (all request ok 100%)```
There is no problem in the situation where there is one manage, one leader.

I added another manage node. 

manage-A, manage-B, NODE-c

- request to manager-A (leader)
```
$ docker -H manager-A:3377 run -d nginx:1.10 
74607ba53b61ac5cc2be884c04620e71e250d6d8088946400f602cbcb30f497d 
```
manager-A swarm log
```
time="2017-03-04T10:35:58+09:00" level=debug msg="HTTP request received" method=POST uri="/v1.23/containers/create"
time="2017-03-04T10:35:58+09:00" level=debug msg="Scheduling container 74607ba53b61 to " NodeID="L57L:BQEM:SX3E:UV3K:F6H2:Y72W:CGYN:S2JA:NRXY:EHNA:MO36:XXOP" NodeName=NODE-c
time="2017-03-04T10:35:58+09:00" level=debug msg="HTTP request received" method=POST uri="/v1.23/containers/74607ba53b61ac5cc2be884c04620e71e250d6d8088946400f602cbcb30f497d/start"
time="2017-03-04T10:36:27+09:00" level=debug msg="Watch triggered with 1 nodes" discovery=consul
```

- request to manager-B (secondary)
```
$ docker -H manager-B:3377 run -d nginx:1.10
3238610708a3c0534323d96da931b25b29a446fc1604c973ce6ebdbbae436554
docker: Error response from daemon: 404 page not found.
```
manager-B log
```
time="2017-03-04T10:40:19+09:00" level=debug msg="Proxy hijack request" addr="test-pc"
```
manager-A log
```
time="2017-03-04T10:40:19+09:00" level=debug msg="HTTP request received" method=POST uri="/v1.23/containers/create"
time="2017-03-04T10:40:19+09:00" level=debug msg="Scheduling container 3238610708a3 to " NodeID="L57L:BQEM:SX3E:UV3K:F6H2:Y72W:CGYN:S2JA:NRXY:EHNA:MO36:XXOP" NodeName=NODE-c
time="2017-03-04T10:40:27+09:00" level=debug msg="Watch triggered with 1 nodes" discovery=consul
time="2017-03-04T10:41:09+09:00" level=debug msg="Engine update succeeded" 
```
the start JSON request is not in the log.


- manually create & start request to manager-B  ```success!!```

```
$ docker -H manage-B:3377 create nginx:1.10
8f3e9006d0e02436561cb5da0d4dc575aa997f89769390761a53700e770e6c59
cnd010:~ $ docker -H manage-B:3377 start 8f3e9006d0e02436561cb5da0d4dc575aa997f89769390761a53700e770e6c59 8f3e9006d0e02436561cb5da0d4dc575aa997f89769390761a53700e770e6c59

```

manage-B log log
```
time="2017-03-04T10:44:29+09:00" level=debug msg="Proxy hijack request" addr="test-pc"
time="2017-03-04T10:44:43+09:00" level=debug msg="Proxy hijack request" addr="test-pc"
```

manage-A log
```
time="2017-03-04T10:44:29+09:00" level=debug msg="HTTP request received" method=POST uri="/v1.23/containers/create"
time="2017-03-04T10:44:30+09:00" level=debug msg="Scheduling container 8f3e9006d0e0 to " NodeID="L57L:BQEM:SX3E:UV3K:F6H2:Y72W:CGYN:S2JA:NRXY:EHNA:MO36:XXOP" NodeName=NODE-c
time="2017-03-04T10:44:32+09:00" level=debug msg="Engine update succeeded" id="L57L:BQEM:SX3E:UV3K:F6H2:Y72W:CGYN:S2JA:NRXY:EHNA:MO36:XXOP" name=NODE-c
time="2017-03-04T10:44:43+09:00" level=debug msg="HTTP request received" method=POST uri="/v1.23/containers/8f3e9006d0e02436561cb5da0d4dc575aa997f89769390761a53700e770e6c59/start"
```

It seems that the ```docker run``` command does not work properly when proxying from secondary manage to leader manage host.

**Comment by dongluochen** [comment]
Thanks for the test result. Just want to clarify, when you have 2 managers (1 primary + 1 replica), both works fine. Does the problem only happen with 3 managers (1 primary + 2 replica) and the request is sent to a replica?

**Comment by nowol79** [comment]
Success only when 1 manager + 1 node. 
This is only a problem if there is more than one manager("1 primary+ 1 replica" or "1 primary + 2 replica"..)  and the request is sent to the replica (= proxy hijack request).

**Comment by dongluochen** [comment]
Thank you @nowol79. Can you take tcpdump capture from your nodes for such failure? It'd include capture on client, replica, and primary. You can send it to dong@docker.com if you don't want to put it at github.

**Comment by nowol79** [comment]
Once again, I got the binaries from (githubhttps://github.com/docker/swarm/releases/download/v1.2.6/swarm-1.2.6-linux-x86_64.tgz) and tried to configure the system again. 

The issue has been resolved. ^^;;  
I do not know the exact cause yet.

I have used the swarm binaries as a source for my own builds.
My own builds binary still have the same issue. 

I should download the binaries instead of building them myself. 
Thanks for your support!

ps.
I have emailed the binary that was causing the problem.
I'm sorry to be late.

I'll close the issue. :)
